hit_type,company_name,country,zip_code,city,federal_state,website,booth,profile_url,profile_title,profile_meta_description,profile_headings,website_home_url,website_home_title,website_home_meta_description,website_home_headings,website_about_url,website_about_title,website_about_meta_description,website_about_headings,score,priority_band,category,subcategory,matched_keywords,negative_keywords,country_priority_bucket,country_priority_boost,outreach_angle,website_fetch_error
Exhibitor,COMAC CAL s.r.o.,Czech Republic,739 53,Tranovice,,https://www.comaccal.com,"Hall 27, Stand G10",https://www.hannovermesse.de/exhibitor/comac-cal/N1565994,HANNOVER MESSE Exhibitor 2026: COMAC CAL,"Since its founding, COMAC CAL s.r.o. has been dedicated to advancing the field of measurement and sensor technology.  With our own dedicated development center, we specialize in delivering custom solutions that perfectly align with our clients' unique requirements across diverse industrial sectors. Our roots reach back to 1987, starting with the development of residential heat meters. Since those early days, we have expanded into a world-class provider of complex measuring systems.  We pride ourselves on solving specific technical challenges and finding the optimal starting point for any project. Furthermore, our authorized Metrological and Calibration Center allows us to fully verify and certify every sensor and system designed by our expert team.",,https://www.comaccal.com/,Quality manufacturer and supplier | COMAC CAL s.r.o.,"Manufacturer of flowmeters, sensors, dispensers, heat meters with metrology center and laboratory. We provide technical support, installation and service.",Measurement? We have the SOLUTION! | Our portfolio | Products | Research & Development | Frequently Asked Questions | Services | Technical Support | Metrology Centre,https://www.comaccal.com/o-nas,Measuring and sensor technology | COMAC CAL s.r.o.,"Czech manufacturing and development of flow meters, sensors, dispensers, heat and cold meters with metrology center and laboratory.",About COMAC CAL | The future of measurement starts with us | Our team | Marcel Maceček | Martin Horák | Jana Shepperson | Vision and future | Our vision,21,C,partner_target,inspection_hardware_or_metrology,"measurement, metrology, sensor",,priority_europe,6,"Explore integration with manual or semi-automated inspection hardware, sensors, or metrology equipment.",
Exhibitor,Comeco AD,Bulgaria,4000,Plovdiv,,http://www.comeco.io,"Hall 17, Stand B12",https://www.hannovermesse.de/exhibitor/comeco-inc-/N1613571,HANNOVER MESSE Exhibitor 2026: Comeco Inc.,"Comeco has over 35 years of experience in manufacturing and providing services related to industrial measurement, control, and automation. The company was founded in 1989 and in a short timeframe, developed and started producing its own range of products including analog and digital transmitters, controllers, indicators, and sensors to provide for end-to-end measurement, control, and automation solutions.  Comeco has its own manufacturing facility based in Plovdiv, Bulgaria where it has implemented the quality control system ISO 9001:2015. The company has a developed domestic and international distributor network.  Our calibration laboratory is certified by ISO 17025:2018 and offers calibration of primary physical quantities for products made by Comeco and by other manufacturers.",,https://comeco.io/,"Comeco - Precise measurement, control, and automation solutions","Learn more about our custom solutions for measurement, control, and industrial automation. Find a suitable solution for your industry.",Grow with us | BESPOKE PRODUCTS | CALIBRATION LABORATORY | ENGINEERING | WHY COMECO? | Leading manufacturer of automation and industrial control solutions | TRUSTED BY | AUTHORIZED DISTRIBUTOR,https://comeco.io/,"Comeco - Precise measurement, control, and automation solutions","Learn more about our custom solutions for measurement, control, and industrial automation. Find a suitable solution for your industry.",Grow with us | BESPOKE PRODUCTS | CALIBRATION LABORATORY | ENGINEERING | WHY COMECO? | Leading manufacturer of automation and industrial control solutions | TRUSTED BY | AUTHORIZED DISTRIBUTOR,21,C,partner_target,inspection_hardware_or_metrology,"automation, measurement, quality control",,priority_europe,6,"Explore integration with manual or semi-automated inspection hardware, sensors, or metrology equipment.",
Exhibitor,Hexagon Manufacturing Intelligence Management Limited,United Kingdom,,Cobham KT11 1HY,,https://www.hexagon.com,"Hall 17, Stand F20",https://www.hannovermesse.de/exhibitor/hexagon/N1480486,HANNOVER MESSE Exhibitor 2026: Hexagon,"At Hexagon, we don’t just measure the world – we define its future. As the global leader in measurement technologies, we provide the confidence that vital industries rely on to build, navigate, and innovate. From microns to Mars, our solutions drive productivity, quality, safety, and sustainability across aerospace, agriculture, automotive, construction, manufacturing, and mining. Yet measurement is only the beginning. We bridge the physical and digital worlds with cutting-edge metrology, reality capture, and positioning solutions – making industries and cities safer, smarter, and more sustainable. Looking forward we are striving to enable our customers to meet sustainability and demographic challenges – ultimately advancing them towards truly autonomous solutions.Measurement is the foundation of progress. When it has to be right, it has to be Hexagon.",,https://www.hexagon.com,,,,,,,,20,C,partner_target,inspection_hardware_or_metrology,"measurement, metrology",,priority_uk,8,"Explore integration with manual or semi-automated inspection hardware, sensors, or metrology equipment.",403 Client Error: Forbidden for url: https://www.hexagon.com/
Exhibitor,Viscom SE,Germany,30455,Hannover,Lower Saxony,https://www.viscom.com,"Hall 26, Stand E98, (17)",https://www.hannovermesse.de/exhibitor/viscom/N1607715,HANNOVER MESSE Exhibitor 2026: Viscom,"Inspection solutions for the security and defense industry  For more than four decades, Viscom has been developing and manufacturing high-precision inspection systems “Made in Germany” at its location in Hanover. The aim is to reliably identify even the smallest defects before they impair performance, safety, or operational readiness. In regulated and safety-critical industries, Viscom ensures that every electronic assembly meets the defined specifications and mission-critical requirements exactly.",,https://www.viscom.com/en/,Inspection Systems for the Electronics Industry | Viscom – Viscom,Viscom SE develops and sells systems for automatic optical inspection (AOI) and X-ray inspection (AXI/MXI) for electronics production worldwide.,Solder Paste Inspection | 3D SPI | Optical Inspection | 3D AOI | X-ray Inspection | 3D AXI | Conformal Coating Inspection | Bond Inspection | Battery Inspection | Software Solutions | Profile,https://www.viscom.com/en/company/profile/,Profile – Viscom,Viscom SE develops and sells systems for automatic optical inspection (AOI) and X-ray inspection (AXI/MXI) for electronics production worldwide.,Solder Paste Inspection | 3D SPI | Optical Inspection | 3D AOI | X-ray Inspection | 3D AXI | Conformal Coating Inspection | Bond Inspection | Battery Inspection | Software Solutions | Profile,18,C,partner_target,inspection_hardware_or_metrology,"inspection, x-ray",,priority_europe,6,"Explore integration with manual or semi-automated inspection hardware, sensors, or metrology equipment.",
Exhibitor,Vision Engineering Ltd.,Germany,82275,Emmering,Bavaria,http://www.visioneng.de,"Hall 26, Stand B31",https://www.hannovermesse.de/exhibitor/vision-engineering/Z446565,HANNOVER MESSE Exhibitor 2026: Vision Engineering,"Vision Engineering Ltd is a leading-edge manufacturer of ergonomic stereo microscopes and non-contact measuring systems. Since its formation in 1958, Vision Engineering has become one of the world's most innovative and dynamic microscope manufacturers, with offices across Europe, Asia and North America. Vision Engineering's main manufacturing base is at Send near Woking in Surrey, UK. Engineers and scientists worldwide use our systems for a wide range of general magnification, inspection and measurement application in both industrial and life science markets. More than 300,000 units have been installed worldwide to date.",,https://www.visioneng.de/,Home - Vision Engineering,"Weltmarktführer für ergonomische Stereomikroskope, digitale 3D-Inspektionssysteme und Messtechniklösungen.","Weltweit führend in okularloser ergonomischer Mikroskopie und Messtechnik, sowie digitaler | 3D-Visualisierung | Lösungen | Produkte | NEUER EU-ONLINE-SHOP | Lynx EVO | Mantis | ERFOLGSSTORYS",https://www.visioneng.de/unternehmen/,Unternehmen - Vision Engineering,,Vision Engineering. | Entdecken Sie Vision Engineering | Kreative Innovation | Kompromisslose Qualität | Erhöhter Bedienerkomfort dank fortschrittlicher Ergonomie | Produktivität durch gesteigerten Komfort | Einfache Hand-Augen-Koordination | Globale Präsenz. Regionaler Service.,18,C,partner_target,inspection_hardware_or_metrology,"inspection, measurement",,priority_europe,6,"Explore integration with manual or semi-automated inspection hardware, sensors, or metrology equipment.",
